<?xml version="1.0" encoding="UTF-8"?>

<!-- Linking the xsl file for transforming -->
<?xml-stylesheet type="text/xsl" href="studioone.xsl"?>
<studioone xmlns:xsi="http://www.w3.org/2001/XMLSchema-instance" xsi:noNamespaceSchemaLocation="studioone.xsd">
    <stocksong>
        <album>aa</album>
        <artist></artist>
        <country></country>
        <company></company>
        <song></song>
        <media></media>
        <price></price>
        <year></year>
    </stocksong>
    <stocksong>
        <album></album>
        <artist></artist>
        <country></country>
        <company></company>
        <song></song>
        <media></media>
        <price></price>
        <year></year>
    </stocksong>
    <stocksong>
        <album></album>
        <artist></artist>
        <country></country>
        <company></company>
        <song></song>
        <media></media>
        <price></price>
        <year></year>
    </stocksong>
    <stocksong>
        <album></album>
        <artist></artist>
        <country></country>
        <company></company>
        <song></song>
        <media></media>
        <price></price>
        <year></year>
    </stocksong>
    <stocksong>
        <album></album>
        <artist></artist>
        <country></country>
        <company></company>
        <song></song>
        <media></media>
        <price></price>
        <year></year>
    </stocksong>
    <stocksong>
        <album></album>
        <artist></artist>
        <country></country>
        <company></company>
        <song></song>
        <media></media>
        <price></price>
        <year></year>
    </stocksong>
    <stocksong>
        <album></album>
        <artist></artist>
        <country></country>
        <company></company>
        <song></song>
        <media></media>
        <price></price>
        <year></year>
    </stocksong>
    <stocksong>
        <album></album>
        <artist></artist>
        <country></country>
        <company></company>
        <song></song>
        <media></media>
        <price></price>
        <year></year>
    </stocksong>
    <stocksong>
        <album></album>
        <artist></artist>
        <country></country>
        <company></company>
        <song></song>
        <media></media>
        <price></price>
        <year></year>
    </stocksong>
    <stocksong>
        <album></album>
        <artist></artist>
        <country></country>
        <company></company>
        <song></song>
        <media></media>
        <price></price>
        <year></year>
    </stocksong>
    <stocksong>
        <album></album>
        <artist></artist>
        <country></country>
        <company></company>
        <song></song>
        <media></media>
        <price></price>
        <year></year>
    </stocksong>
    <stocksong>
        <album></album>
        <artist></artist>
        <country></country>
        <company></company>
        <song></song>
        <media></media>
        <price></price>
        <year></year>
    </stocksong>
    <stocksong>
        <album></album>
        <artist></artist>
        <country></country>
        <company></company>
        <song></song>
        <media></media>
        <price></price>
        <year></year>
    </stocksong>
    <stocksong>
        <album></album>
        <artist></artist>
        <country></country>
        <company></company>
        <song></song>
        <media></media>
        <price></price>
        <year></year>
    </stocksong>
    <stocksong>
        <album></album>
        <artist></artist>
        <country></country>
        <company></company>
        <song></song>
        <media></media>
        <price></price>
        <year></year>
    </stocksong>
    <stocksong>
        <album></album>
        <artist></artist>
        <country></country>
        <company></company>
        <song></song>
        <media></media>
        <price></price>
        <year></year>
    </stocksong>
    <stocksong>
        <album></album>
        <artist></artist>
        <country></country>
        <company></company>
        <song></song>
        <media></media>
        <price></price>
        <year></year>
    </stocksong>
    <stocksong>
        <album></album>
        <artist></artist>
        <country></country>
        <company></company>
        <song></song>
        <media></media>
        <price></price>
        <year></year>
    </stocksong>
    <stocksong>
        <album></album>
        <artist></artist>
        <country></country>
        <company></company>
        <song></song>
        <media></media>
        <price></price>
        <year></year>
    </stocksong>
    <stocksong>
        <album></album>
        <artist></artist>
        <country></country>
        <company></company>
        <song></song>
        <media></media>
        <price></price>
        <year></year>
    </stocksong>
</studioone>